{
  "assessment_id": "PREFLIGHT-MM-ART-001-001",
  "assessment_version": "0.1.0",
  "assessment_date": "2026-08-31",
  "product": "Mm Art 001 Fox Mesh Collection",
  "scope": {
    "intended_use": "Provide printable fox-themed decorative meshes and their reference assets for non-functional display use.",
    "user_context": "Retrospectively derived from the current product folder; exact user, host variant, environment, and release state remain limited to cited evidence.",
    "variants": [
      "UNVERSIONED-CURRENT"
    ],
    "out_of_scope": [
      "Claims not explicitly supported by the cited repository evidence",
      "Production release without closure of blocking gates"
    ]
  },
  "entities": [
    {
      "id": "E-PRINT-001",
      "kind": "PRINTED_PART",
      "name": "Mm Art 001 Fox Mesh Collection"
    },
    {
      "id": "E-ENV-001",
      "kind": "ENVIRONMENT",
      "name": "Display or use surface"
    }
  ],
  "interfaces": [
    {
      "id": "IF-ENV-GEO-SUP-PLN-001",
      "name": "Printed product to display or use surface",
      "endpoint_b": "E-ENV-001",
      "boundary": "ENV",
      "domains": [
        "GEO",
        "MEC"
      ],
      "function": "SUP",
      "geometry": "PLN",
      "endpoint_a": "E-PRINT-001",
      "lifecycle_states": [
        "assembly",
        "use",
        "cleaning",
        "service",
        "disassembly",
        "storage"
      ],
      "dimensions": [
        {
          "id": "DIM-PRIMARY-001",
          "feature": "Primary interface envelope and functional allowance",
          "nominal_mm": null,
          "lower_mm": null,
          "upper_mm": null,
          "clearance_mm": null,
          "uncertainty_mm": null,
          "status": "UNKNOWN",
          "source_ref": "textured_mesh.stl",
          "criticality": "COSMETIC"
        }
      ],
      "evidence": {
        "level": "E1",
        "sources": [
          "textured_mesh.stl",
          "textured_mesh.obj",
          "textured_mesh.3mf",
          "prompt.md",
          "tripodsg/tmpibp9kn1u.glb",
          "tripodsg/tmpcg4f2rw4.glb",
          "direct3D-2/20260718173506.obj"
        ],
        "variant_confirmed": false,
        "coverage_percent": 35,
        "uncertainty_note": "The retrospective audit did not establish a variant-confirmed tolerance and uncertainty budget.",
        "observability": "INFERRED"
      },
      "interface_complexity": {
        "GEO": 2,
        "KIN": 0,
        "TOL": 0,
        "PHY": 0,
        "VAR": 0,
        "LIF": 1,
        "total": 3,
        "tier": "I0"
      },
      "criticality": "K0",
      "failure_modes": [
        {
          "mode": "Primary interface does not meet fit or functional intent",
          "effect": "Loss of intended function and the credible failure effects recorded at product level",
          "mitigation": "Confirm the exact variant, measure the interface, define tolerances, and test a coupon or controlled prototype."
        }
      ],
      "verification": {
        "method": "inspection",
        "acceptance_criteria": [
          "Variant-confirmed, measurable interface criteria are approved and the planned verification passes before release."
        ],
        "status": "PLANNED",
        "result_refs": []
      },
      "owner": "product owner",
      "version": "0.1"
    }
  ],
  "complexity": {
    "dimension_scores": {
      "REQ": 0,
      "CTX": 0,
      "PAR": 1,
      "INT": 0,
      "CPL": 0,
      "MOT": 0,
      "GEO": 2,
      "PHY": 0,
      "MAT": 1,
      "EXT": 3,
      "VER": 0
    },
    "score_0_100": 13.0,
    "class": "C0",
    "drivers": [
      "EXT=3: Purchased hardware, printer equipment, electronics, or software participates in the system.",
      "GEO=2: Geometry appears conventional or non-fit-critical, although exact dimensions were not re-derived.",
      "PAR=1: The current evidence exposes approximately 4 distinct geometry-file stems; exports may duplicate physical parts."
    ]
  },
  "readiness": {
    "level": "R1",
    "component_levels": {
      "scope_variant": "R1",
      "requirements": "R1",
      "critical_interfaces": "R1",
      "manufacturing_profile": "R1",
      "verification": "R1"
    },
    "blocking_unknowns": [
      "stable current product revision",
      "variant-confirmed critical interface dimensions, tolerances, and uncertainty",
      "complete printer/material/nozzle/orientation/process-profile set",
      "measurable acceptance criteria",
      "verification plan and physical result references"
    ],
    "completeness_percent": 20.0
  },
  "criticality": {
    "level": "K0",
    "rationale": "The documented scope is decorative/display-only; failure primarily wastes a print or degrades appearance.",
    "credible_failure_effects": [
      "cosmetic dissatisfaction",
      "wasted print"
    ]
  },
  "gates": {
    "G0": "WARN",
    "G1": "WARN",
    "G2": "PASS",
    "G3": "FAIL",
    "G4": "FAIL",
    "G5": "PASS",
    "G6": "WARN"
  },
  "decision": {
    "lane": "E",
    "confidence": "LOW_UNKNOWN",
    "design_release": "HOLD",
    "rationale": "The retrospective preflight blocks release wherever interface evidence, the exact manufacturing profile, lifecycle controls, or measurable verification remains incomplete."
  },
  "warnings": [
    {
      "code": "VARIANT_UNKNOWN",
      "severity": "WARN",
      "message": "No stable current product revision is evidenced at the product boundary."
    },
    {
      "code": "VERIFICATION_NOT_DEFINED",
      "severity": "BLOCKER",
      "message": "Printer, material, nozzle, orientation, and process profile are not documented as one complete exact set."
    }
  ],
  "next_actions": [
    {
      "priority": 1,
      "action": "Confirm the exact product/host variant and complete the primary interface contract.",
      "exit_criterion": "Datums, nominal dimensions, tolerances, measurement uncertainty, keep-outs, and variant identity are recorded from traceable evidence."
    },
    {
      "priority": 2,
      "action": "Record the exact manufacturing profile.",
      "exit_criterion": "Printer, material, nozzle, orientation, and complete process profile are uniquely identified and source-linked."
    },
    {
      "priority": 3,
      "action": "Define measurable acceptance criteria and a minimal coupon/prototype test.",
      "exit_criterion": "Each critical interface and credible failure mode has a method, threshold, and result-record location."
    }
  ],
  "traceability": {
    "mode": "RETROSPECTIVE",
    "project_id": "MM-ART-001",
    "project_revision": "UNVERSIONED-CURRENT",
    "basis_refs": [
      "textured_mesh.stl",
      "textured_mesh.obj",
      "textured_mesh.3mf",
      "prompt.md",
      "tripodsg/tmpibp9kn1u.glb",
      "tripodsg/tmpcg4f2rw4.glb",
      "direct3D-2/20260718173506.obj"
    ],
    "change_triggers": [
      "backfill_missing_preflight",
      "portfolio_documentation_audit",
      "product_root_version_cleanup"
    ],
    "previous_assessment_id": null,
    "created_at": "2026-08-31T12:29:39+02:00",
    "updated_at": "2026-08-31T12:29:39+02:00"
  }
}
