{
  "assessment_id": "PREFLIGHT-MM-ACC-001-001",
  "assessment_version": "0.1.0",
  "assessment_date": "2026-08-31",
  "product": "Monolithic Geometric Hair Clip",
  "scope": {
    "intended_use": "Retain a range of hair volumes with a metal-free, print-in-place rotary hair clip and separate snap latch.",
    "user_context": "Retrospectively derived from the current product folder; exact user, host variant, environment, and release state remain limited to cited evidence.",
    "variants": [
      "6"
    ],
    "out_of_scope": [
      "Claims not explicitly supported by the cited repository evidence",
      "Production release without closure of blocking gates"
    ]
  },
  "entities": [
    {
      "id": "E-PRINT-001",
      "kind": "PRINTED_PART",
      "name": "Monolithic Geometric Hair Clip"
    },
    {
      "id": "E-HUM-001",
      "kind": "HUMAN",
      "name": "Intended user or body interface"
    }
  ],
  "interfaces": [
    {
      "id": "IF-HUM-HUM-USR-BODY-001",
      "name": "Printed product to intended user/body",
      "endpoint_b": "E-HUM-001",
      "boundary": "HUM",
      "domains": [
        "GEO",
        "MEC",
        "HUM"
      ],
      "function": "USR",
      "geometry": "BODY",
      "endpoint_a": "E-PRINT-001",
      "lifecycle_states": [
        "assembly",
        "use",
        "cleaning",
        "service",
        "disassembly",
        "storage"
      ],
      "dimensions": [
        {
          "id": "DIM-PRIMARY-001",
          "feature": "Primary interface envelope and functional allowance",
          "nominal_mm": null,
          "lower_mm": null,
          "upper_mm": null,
          "clearance_mm": null,
          "uncertainty_mm": null,
          "status": "UNKNOWN",
          "source_ref": "design-spec.yaml",
          "criticality": "FUNCTION_CRITICAL"
        }
      ],
      "evidence": {
        "level": "E2",
        "sources": [
          "design-spec.yaml",
          "README.md",
          "SHA256SUMS.txt",
          "release-report.md",
          "reconstruction-brief.yaml",
          "package.json",
          "package-lock.json",
          "decision-log.md"
        ],
        "variant_confirmed": false,
        "coverage_percent": 55,
        "uncertainty_note": "The retrospective audit did not establish a variant-confirmed tolerance and uncertainty budget.",
        "observability": "PARTLY_OBSERVED"
      },
      "interface_complexity": {
        "GEO": 4,
        "KIN": 3,
        "TOL": 4,
        "PHY": 3,
        "VAR": 4,
        "LIF": 3,
        "total": 21,
        "tier": "I5"
      },
      "criticality": "K2",
      "failure_modes": [
        {
          "mode": "Primary interface does not meet fit or functional intent",
          "effect": "Loss of intended function and the credible failure effects recorded at product level",
          "mitigation": "Confirm the exact variant, measure the interface, define tolerances, and test a coupon or controlled prototype."
        }
      ],
      "verification": {
        "method": "prototype_test",
        "acceptance_criteria": [
          "Variant-confirmed, measurable interface criteria are approved and the planned verification passes before release."
        ],
        "status": "PLANNED",
        "result_refs": []
      },
      "owner": "product owner",
      "version": "0.1"
    }
  ],
  "complexity": {
    "dimension_scores": {
      "REQ": 3,
      "CTX": 4,
      "PAR": 3,
      "INT": 4,
      "CPL": 3,
      "MOT": 3,
      "GEO": 4,
      "PHY": 3,
      "MAT": 4,
      "EXT": 1,
      "VER": 4
    },
    "score_0_100": 83.0,
    "class": "C5",
    "drivers": [
      "INT=4: At least one functional host, human, medium, or assembly boundary governs success.",
      "PHY=3: Load, heat, airflow, water, fatigue, or another functional physical domain must be tested.",
      "PAR=3: The current evidence exposes approximately 6 distinct geometry-file stems; exports may duplicate physical parts."
    ]
  },
  "readiness": {
    "level": "R2",
    "component_levels": {
      "scope_variant": "R3",
      "requirements": "R3",
      "critical_interfaces": "R2",
      "manufacturing_profile": "R3",
      "verification": "R2"
    },
    "blocking_unknowns": [
      "variant-confirmed critical interface dimensions, tolerances, and uncertainty",
      "verification plan and physical result references"
    ],
    "completeness_percent": 52.0
  },
  "criticality": {
    "level": "K2",
    "rationale": "The product involves load, flow, motion, heat-adjacent use, or direct body contact and therefore requires controlled functional testing.",
    "credible_failure_effects": [
      "functional failure",
      "leakage, obstruction, or detachment",
      "minor injury or property damage"
    ]
  },
  "gates": {
    "G0": "PASS",
    "G1": "PASS",
    "G2": "FAIL",
    "G3": "PASS",
    "G4": "WARN",
    "G5": "PASS",
    "G6": "PASS"
  },
  "decision": {
    "lane": "E",
    "confidence": "LOW_UNKNOWN",
    "design_release": "HOLD",
    "rationale": "The retrospective preflight blocks release wherever interface evidence, the exact manufacturing profile, lifecycle controls, or measurable verification remains incomplete."
  },
  "warnings": [
    {
      "code": "CRITICAL_INTERFACE_UNKNOWN",
      "severity": "BLOCKER",
      "message": "The primary functional interface lacks variant-confirmed dimensions, tolerance, and uncertainty evidence."
    },
    {
      "code": "DYNAMIC_OR_FATIGUE_LOAD",
      "severity": "WARN",
      "message": "Repeated motion, flexure, vibration, or dynamic contact needs cycle and failure testing."
    },
    {
      "code": "DEFORMABLE_HUMAN_INTERFACE",
      "severity": "WARN",
      "message": "Human geometry, deformation, comfort, and use-state variation are not controlled by repository evidence alone."
    }
  ],
  "next_actions": [
    {
      "priority": 1,
      "action": "Confirm the exact product/host variant and complete the primary interface contract.",
      "exit_criterion": "Datums, nominal dimensions, tolerances, measurement uncertainty, keep-outs, and variant identity are recorded from traceable evidence."
    },
    {
      "priority": 2,
      "action": "Define measurable acceptance criteria and a minimal coupon/prototype test.",
      "exit_criterion": "Each critical interface and credible failure mode has a method, threshold, and result-record location."
    }
  ],
  "traceability": {
    "mode": "RETROSPECTIVE",
    "project_id": "MM-ACC-001",
    "project_revision": "6",
    "basis_refs": [
      "design-spec.yaml",
      "README.md",
      "SHA256SUMS.txt",
      "release-report.md",
      "reconstruction-brief.yaml",
      "package.json",
      "package-lock.json",
      "decision-log.md"
    ],
    "change_triggers": [
      "backfill_missing_preflight",
      "portfolio_documentation_audit",
      "product_root_version_cleanup"
    ],
    "previous_assessment_id": null,
    "created_at": "2026-08-31T12:29:39+02:00",
    "updated_at": "2026-08-31T12:29:39+02:00"
  }
}
